{
  "schemaVersion": "1.0",
  "modelId": "semantic-product-1",
  "inventoryId": "product-1",
  "scenario": {
    "primary": "product-capability"
  },
  "audienceIntent": "quick-understanding",
  "facts": [
    {
      "id": "c1",
      "type": "conclusion",
      "text": "产品提供从输入到结论的完整能力",
      "importance": "critical",
      "sourceRef": "c1",
      "confidence": "supported"
    },
    {
      "id": "h1",
      "type": "capability",
      "text": "数据接入与权限控制",
      "importance": "high",
      "sourceRef": "h1",
      "confidence": "supported"
    },
    {
      "id": "h2",
      "type": "capability",
      "text": "智能分析与异常识别",
      "importance": "high",
      "sourceRef": "h2",
      "confidence": "supported"
    },
    {
      "id": "h3",
      "type": "capability",
      "text": "报告生成与团队复用",
      "importance": "high",
      "sourceRef": "h3",
      "confidence": "supported"
    },
    {
      "id": "e1",
      "type": "evidence",
      "text": "已覆盖五类高频工作场景",
      "importance": "high",
      "sourceRef": "e1",
      "confidence": "supported"
    },
    {
      "id": "a1",
      "type": "action",
      "text": "下一步扩展团队协作能力",
      "importance": "high",
      "sourceRef": "a1",
      "confidence": "supported"
    }
  ],
  "relationships": [],
  "readingLayers": {
    "first": [
      "c1"
    ],
    "second": [
      "h1",
      "h2",
      "h3",
      "e1",
      "a1"
    ]
  },
  "completenessLedger": {
    "selected": [
      "c1",
      "h1",
      "h2",
      "h3",
      "e1",
      "a1"
    ],
    "merged": [],
    "downgraded": [],
    "omitted": []
  },
  "archetypeEvidence": [
    {
      "scenario": "product-capability",
      "score": 15,
      "evidence": {
        "titleTerms": [
          "产品",
          "能力",
          "介绍",
          "助手"
        ],
        "factTypeHits": 3,
        "laneBonus": 0,
        "timeBonus": 0,
        "futureBonus": 0
      }
    },
    {
      "scenario": "process-collaboration",
      "score": 3,
      "evidence": {
        "titleTerms": [
          "协作"
        ],
        "factTypeHits": 0,
        "laneBonus": 0,
        "timeBonus": 0,
        "futureBonus": 0
      }
    },
    {
      "scenario": "review-update",
      "score": 2,
      "evidence": {
        "titleTerms": [],
        "factTypeHits": 2,
        "laneBonus": 0,
        "timeBonus": 0,
        "futureBonus": 0
      }
    },
    {
      "scenario": "research-decision",
      "score": 1,
      "evidence": {
        "titleTerms": [],
        "factTypeHits": 1,
        "laneBonus": 0,
        "timeBonus": 0,
        "futureBonus": 0
      }
    },
    {
      "scenario": "strategy-proposal",
      "score": 1,
      "evidence": {
        "titleTerms": [],
        "factTypeHits": 1,
        "laneBonus": 0,
        "timeBonus": 0,
        "futureBonus": 0
      }
    },
    {
      "scenario": "project-plan",
      "score": 0,
      "evidence": {
        "titleTerms": [],
        "factTypeHits": 0,
        "laneBonus": 0,
        "timeBonus": 0,
        "futureBonus": 0
      }
    }
  ]
}
