{
  "schemaVersion": "1.0",
  "modelId": "semantic-official-research-coding-agents",
  "inventoryId": "official-research-coding-agents",
  "scenario": {
    "primary": "research-decision"
  },
  "audienceIntent": "quick-understanding",
  "facts": [
    {
      "id": "q1",
      "type": "unresolved",
      "text": "编码 Agent 是否正在改变社会科学研究生产率与资源差异",
      "importance": "critical",
      "sourceRef": "q1",
      "confidence": "supported"
    },
    {
      "id": "m1",
      "type": "metric",
      "text": "81% 的受访者尝试过在研究中使用 AI 聊天工具",
      "importance": "high",
      "sourceRef": "m1",
      "confidence": "supported",
      "value": "81%",
      "visualType": "metric",
      "measure": {
        "value": "81",
        "unit": "%",
        "display": "81%"
      }
    },
    {
      "id": "m2",
      "type": "metric",
      "text": "20% 的受访者已采用编码 Agent",
      "importance": "high",
      "sourceRef": "m2",
      "confidence": "supported",
      "value": "20%",
      "visualType": "metric",
      "measure": {
        "value": "20",
        "unit": "%",
        "display": "20%"
      }
    },
    {
      "id": "e1",
      "type": "evidence",
      "text": "编码 Agent 用户发布更多工作论文和基金申请",
      "importance": "high",
      "sourceRef": "e1",
      "confidence": "supported"
    },
    {
      "id": "r1",
      "type": "risk",
      "text": "观察结果不能排除早期采用者原本就更高产的解释",
      "importance": "high",
      "sourceRef": "r1",
      "confidence": "supported"
    },
    {
      "id": "c1",
      "type": "conclusion",
      "text": "需要随机实验才能判断编码 Agent 的因果影响",
      "importance": "high",
      "sourceRef": "c1",
      "confidence": "supported"
    }
  ],
  "relationships": [],
  "readingLayers": {
    "first": [
      "q1"
    ],
    "second": [
      "m1",
      "m2",
      "e1",
      "r1",
      "c1"
    ]
  },
  "completenessLedger": {
    "selected": [
      "q1",
      "m1",
      "m2",
      "e1",
      "r1",
      "c1"
    ],
    "merged": [],
    "downgraded": [],
    "omitted": []
  },
  "archetypeEvidence": [
    {
      "scenario": "research-decision",
      "score": 8,
      "evidence": {
        "titleTerms": [
          "调研",
          "研究"
        ],
        "factTypeHits": 2,
        "laneBonus": 0,
        "timeBonus": 0,
        "futureBonus": 0
      }
    },
    {
      "scenario": "review-update",
      "score": 4,
      "evidence": {
        "titleTerms": [],
        "factTypeHits": 4,
        "laneBonus": 0,
        "timeBonus": 0,
        "futureBonus": 0
      }
    },
    {
      "scenario": "product-capability",
      "score": 1,
      "evidence": {
        "titleTerms": [],
        "factTypeHits": 1,
        "laneBonus": 0,
        "timeBonus": 0,
        "futureBonus": 0
      }
    },
    {
      "scenario": "project-plan",
      "score": 1,
      "evidence": {
        "titleTerms": [],
        "factTypeHits": 1,
        "laneBonus": 0,
        "timeBonus": 0,
        "futureBonus": 0
      }
    },
    {
      "scenario": "strategy-proposal",
      "score": 1,
      "evidence": {
        "titleTerms": [],
        "factTypeHits": 1,
        "laneBonus": 0,
        "timeBonus": 0,
        "futureBonus": 0
      }
    },
    {
      "scenario": "process-collaboration",
      "score": 0,
      "evidence": {
        "titleTerms": [],
        "factTypeHits": 0,
        "laneBonus": 0,
        "timeBonus": 0,
        "futureBonus": 0
      }
    }
  ]
}
