{
  "schemaVersion": "1.0",
  "modelId": "semantic-plan-1",
  "inventoryId": "plan-1",
  "scenario": {
    "primary": "project-plan"
  },
  "audienceIntent": "quick-understanding",
  "facts": [
    {
      "id": "c1",
      "type": "objective",
      "text": "项目分三阶段交付",
      "importance": "critical",
      "sourceRef": "c1",
      "confidence": "supported"
    },
    {
      "id": "p1",
      "type": "stage",
      "text": "阶段一完成需求对齐",
      "importance": "high",
      "sourceRef": "p1",
      "confidence": "supported",
      "order": 1
    },
    {
      "id": "p2",
      "type": "stage",
      "text": "阶段二完成试点上线",
      "importance": "high",
      "sourceRef": "p2",
      "confidence": "supported",
      "order": 2
    },
    {
      "id": "p3",
      "type": "stage",
      "text": "阶段三完成规模推广",
      "importance": "high",
      "sourceRef": "p3",
      "confidence": "supported",
      "order": 3
    },
    {
      "id": "r1",
      "type": "risk",
      "text": "依赖接口交付时间",
      "importance": "high",
      "sourceRef": "r1",
      "confidence": "supported"
    },
    {
      "id": "a1",
      "type": "action",
      "text": "本周确认里程碑责任人",
      "importance": "high",
      "sourceRef": "a1",
      "confidence": "supported"
    }
  ],
  "relationships": [],
  "readingLayers": {
    "first": [
      "c1"
    ],
    "second": [
      "p1",
      "p2",
      "p3",
      "r1",
      "a1"
    ]
  },
  "completenessLedger": {
    "selected": [
      "c1",
      "p1",
      "p2",
      "p3",
      "r1",
      "a1"
    ],
    "merged": [],
    "downgraded": [],
    "omitted": []
  },
  "archetypeEvidence": [
    {
      "scenario": "project-plan",
      "score": 11,
      "evidence": {
        "titleTerms": [
          "实施计划",
          "里程碑"
        ],
        "factTypeHits": 3,
        "laneBonus": 0,
        "timeBonus": 0,
        "futureBonus": 2
      }
    },
    {
      "scenario": "review-update",
      "score": 5,
      "evidence": {
        "titleTerms": [
          "阶段"
        ],
        "factTypeHits": 2,
        "laneBonus": 0,
        "timeBonus": 0,
        "futureBonus": 0
      }
    },
    {
      "scenario": "product-capability",
      "score": 3,
      "evidence": {
        "titleTerms": [],
        "factTypeHits": 3,
        "laneBonus": 0,
        "timeBonus": 0,
        "futureBonus": 0
      }
    },
    {
      "scenario": "process-collaboration",
      "score": 2,
      "evidence": {
        "titleTerms": [],
        "factTypeHits": 2,
        "laneBonus": 0,
        "timeBonus": 0,
        "futureBonus": 0
      }
    },
    {
      "scenario": "strategy-proposal",
      "score": 1,
      "evidence": {
        "titleTerms": [],
        "factTypeHits": 1,
        "laneBonus": 0,
        "timeBonus": 0,
        "futureBonus": 0
      }
    },
    {
      "scenario": "research-decision",
      "score": 0,
      "evidence": {
        "titleTerms": [],
        "factTypeHits": 0,
        "laneBonus": 0,
        "timeBonus": 0,
        "futureBonus": 0
      }
    }
  ]
}
