{
  "schemaVersion": "1.0",
  "modelId": "semantic-review-3",
  "inventoryId": "review-3",
  "scenario": {
    "primary": "review-update"
  },
  "audienceIntent": "quick-understanding",
  "facts": [
    {
      "id": "c1",
      "type": "conclusion",
      "text": "阶段主线整体达成，第 3 组试点进入稳定期",
      "importance": "critical",
      "sourceRef": "c1",
      "confidence": "supported"
    },
    {
      "id": "m1",
      "type": "metric",
      "text": "目标完成率 79%",
      "importance": "high",
      "sourceRef": "m1",
      "confidence": "supported",
      "value": "79%"
    },
    {
      "id": "m2",
      "type": "metric",
      "text": "效率提升 11%",
      "importance": "high",
      "sourceRef": "m2",
      "confidence": "supported",
      "value": "+11%"
    },
    {
      "id": "r1",
      "type": "risk",
      "text": "跨团队数据口径仍需统一",
      "importance": "high",
      "sourceRef": "r1",
      "confidence": "supported"
    },
    {
      "id": "a1",
      "type": "action",
      "text": "下一阶段建立统一复盘节奏",
      "importance": "high",
      "sourceRef": "a1",
      "confidence": "supported"
    },
    {
      "id": "e1",
      "type": "evidence",
      "text": "连续四周核心指标改善",
      "importance": "medium",
      "sourceRef": "e1",
      "confidence": "supported"
    }
  ],
  "relationships": [],
  "readingLayers": {
    "first": [
      "c1"
    ],
    "second": [
      "m1",
      "m2",
      "r1",
      "a1",
      "e1"
    ]
  },
  "completenessLedger": {
    "selected": [
      "c1",
      "m1",
      "m2",
      "r1",
      "a1",
      "e1"
    ],
    "merged": [],
    "downgraded": [],
    "omitted": []
  },
  "archetypeEvidence": [
    {
      "scenario": "review-update",
      "score": 20,
      "evidence": {
        "titleTerms": [
          "复盘",
          "总结",
          "半年",
          "阶段"
        ],
        "factTypeHits": 5,
        "laneBonus": 0,
        "timeBonus": 3,
        "futureBonus": 0
      }
    },
    {
      "scenario": "strategy-proposal",
      "score": 7,
      "evidence": {
        "titleTerms": [
          "规划",
          "主线"
        ],
        "factTypeHits": 1,
        "laneBonus": 0,
        "timeBonus": 0,
        "futureBonus": 0
      }
    },
    {
      "scenario": "project-plan",
      "score": 3,
      "evidence": {
        "titleTerms": [],
        "factTypeHits": 1,
        "laneBonus": 0,
        "timeBonus": 0,
        "futureBonus": 2
      }
    },
    {
      "scenario": "product-capability",
      "score": 1,
      "evidence": {
        "titleTerms": [],
        "factTypeHits": 1,
        "laneBonus": 0,
        "timeBonus": 0,
        "futureBonus": 0
      }
    },
    {
      "scenario": "research-decision",
      "score": 1,
      "evidence": {
        "titleTerms": [],
        "factTypeHits": 1,
        "laneBonus": 0,
        "timeBonus": 0,
        "futureBonus": 0
      }
    },
    {
      "scenario": "process-collaboration",
      "score": 0,
      "evidence": {
        "titleTerms": [],
        "factTypeHits": 0,
        "laneBonus": 0,
        "timeBonus": 0,
        "futureBonus": 0
      }
    }
  ]
}
