{
  "schemaVersion": "1.0",
  "modelId": "semantic-official-strategy-trustworthy-agents",
  "inventoryId": "official-strategy-trustworthy-agents",
  "scenario": {
    "primary": "strategy-proposal"
  },
  "audienceIntent": "quick-understanding",
  "facts": [
    {
      "id": "c1",
      "type": "conclusion",
      "text": "Agent 治理必须在提升自主性的同时保留可观察、可控制和可追责能力",
      "importance": "critical",
      "sourceRef": "c1",
      "confidence": "supported"
    },
    {
      "id": "k1",
      "type": "constraint",
      "text": "Agent 可能误读用户意图并执行非预期操作",
      "importance": "high",
      "sourceRef": "k1",
      "confidence": "supported"
    },
    {
      "id": "k2",
      "type": "constraint",
      "text": "跨应用工具使用会扩大提示注入和权限滥用风险",
      "importance": "high",
      "sourceRef": "k2",
      "confidence": "supported"
    },
    {
      "id": "e1",
      "type": "evidence",
      "text": "Agent 已在编码、文件管理和多应用任务中产生真实生产力收益",
      "importance": "high",
      "sourceRef": "e1",
      "confidence": "supported"
    },
    {
      "id": "a1",
      "type": "action",
      "text": "建立权限边界、执行前确认、全程追踪和异常回退的治理组合",
      "importance": "high",
      "sourceRef": "a1",
      "confidence": "supported"
    }
  ],
  "relationships": [],
  "readingLayers": {
    "first": [
      "c1"
    ],
    "second": [
      "k1",
      "k2",
      "e1",
      "a1"
    ]
  },
  "completenessLedger": {
    "selected": [
      "c1",
      "k1",
      "k2",
      "e1",
      "a1"
    ],
    "merged": [],
    "downgraded": [],
    "omitted": []
  },
  "archetypeEvidence": [
    {
      "scenario": "strategy-proposal",
      "score": 9,
      "evidence": {
        "titleTerms": [
          "策略",
          "方案"
        ],
        "factTypeHits": 3,
        "laneBonus": 0,
        "timeBonus": 0,
        "futureBonus": 0
      }
    },
    {
      "scenario": "review-update",
      "score": 2,
      "evidence": {
        "titleTerms": [],
        "factTypeHits": 2,
        "laneBonus": 0,
        "timeBonus": 0,
        "futureBonus": 0
      }
    },
    {
      "scenario": "product-capability",
      "score": 1,
      "evidence": {
        "titleTerms": [],
        "factTypeHits": 1,
        "laneBonus": 0,
        "timeBonus": 0,
        "futureBonus": 0
      }
    },
    {
      "scenario": "research-decision",
      "score": 1,
      "evidence": {
        "titleTerms": [],
        "factTypeHits": 1,
        "laneBonus": 0,
        "timeBonus": 0,
        "futureBonus": 0
      }
    },
    {
      "scenario": "process-collaboration",
      "score": 0,
      "evidence": {
        "titleTerms": [],
        "factTypeHits": 0,
        "laneBonus": 0,
        "timeBonus": 0,
        "futureBonus": 0
      }
    },
    {
      "scenario": "project-plan",
      "score": 0,
      "evidence": {
        "titleTerms": [],
        "factTypeHits": 0,
        "laneBonus": 0,
        "timeBonus": 0,
        "futureBonus": 0
      }
    }
  ]
}
