{
  "schemaVersion": "1.0",
  "modelId": "semantic-official-review-claude-code-expertise",
  "inventoryId": "official-review-claude-code-expertise",
  "scenario": {
    "primary": "review-update"
  },
  "audienceIntent": "quick-understanding",
  "facts": [
    {
      "id": "c1",
      "type": "conclusion",
      "text": "Claude Code 使用正在从调试转向端到端的 Agent 工作",
      "importance": "critical",
      "sourceRef": "c1",
      "confidence": "supported"
    },
    {
      "id": "m1",
      "type": "metric",
      "text": "研究覆盖约 40 万次交互会话和约 23.5 万名用户",
      "importance": "high",
      "sourceRef": "m1",
      "confidence": "supported",
      "value": "400K",
      "visualType": "metric",
      "measure": {
        "value": "400",
        "display": "400"
      }
    },
    {
      "id": "m2",
      "type": "metric",
      "text": "七个月内典型任务估算价值平均提高约 25%",
      "importance": "high",
      "sourceRef": "m2",
      "confidence": "supported",
      "value": "+25%",
      "visualType": "metric",
      "measure": {
        "value": "25",
        "unit": "%",
        "qualifier": "+",
        "display": "+25%"
      }
    },
    {
      "id": "t1",
      "type": "stage",
      "text": "早期使用更集中在调试、解释和局部代码修改",
      "importance": "high",
      "sourceRef": "t1",
      "confidence": "supported",
      "order": 1
    },
    {
      "id": "t2",
      "type": "stage",
      "text": "当前使用逐步扩展到设计、实现、测试和部署链路",
      "importance": "high",
      "sourceRef": "t2",
      "confidence": "supported",
      "order": 2
    },
    {
      "id": "e1",
      "type": "evidence",
      "text": "领域经验越强，Agent 每条指令承担的工作越多且成功率更高",
      "importance": "high",
      "sourceRef": "e1",
      "confidence": "supported"
    },
    {
      "id": "r1",
      "type": "risk",
      "text": "专家与中级用户仍存在可测量但不极端的成功率差距",
      "importance": "medium",
      "sourceRef": "r1",
      "confidence": "supported"
    },
    {
      "id": "a1",
      "type": "action",
      "text": "后续持续跟踪端到端任务、非代码产物和部署工作的增长",
      "importance": "high",
      "sourceRef": "a1",
      "confidence": "supported"
    }
  ],
  "relationships": [],
  "readingLayers": {
    "first": [
      "c1"
    ],
    "second": [
      "m1",
      "m2",
      "t1",
      "t2",
      "e1",
      "r1",
      "a1"
    ]
  },
  "completenessLedger": {
    "selected": [
      "c1",
      "m1",
      "m2",
      "t1",
      "t2",
      "e1",
      "r1",
      "a1"
    ],
    "merged": [],
    "downgraded": [],
    "omitted": []
  },
  "archetypeEvidence": [
    {
      "scenario": "review-update",
      "score": 11,
      "evidence": {
        "titleTerms": [
          "复盘"
        ],
        "factTypeHits": 5,
        "laneBonus": 0,
        "timeBonus": 3,
        "futureBonus": 0
      }
    },
    {
      "scenario": "project-plan",
      "score": 3,
      "evidence": {
        "titleTerms": [],
        "factTypeHits": 3,
        "laneBonus": 0,
        "timeBonus": 0,
        "futureBonus": 0
      }
    },
    {
      "scenario": "product-capability",
      "score": 1,
      "evidence": {
        "titleTerms": [],
        "factTypeHits": 1,
        "laneBonus": 0,
        "timeBonus": 0,
        "futureBonus": 0
      }
    },
    {
      "scenario": "research-decision",
      "score": 1,
      "evidence": {
        "titleTerms": [],
        "factTypeHits": 1,
        "laneBonus": 0,
        "timeBonus": 0,
        "futureBonus": 0
      }
    },
    {
      "scenario": "strategy-proposal",
      "score": 1,
      "evidence": {
        "titleTerms": [],
        "factTypeHits": 1,
        "laneBonus": 0,
        "timeBonus": 0,
        "futureBonus": 0
      }
    },
    {
      "scenario": "process-collaboration",
      "score": 0,
      "evidence": {
        "titleTerms": [],
        "factTypeHits": 0,
        "laneBonus": 0,
        "timeBonus": 0,
        "futureBonus": 0
      }
    }
  ]
}
