{
  "schemaVersion": "1.0",
  "modelId": "semantic-stress-weak-conclusion",
  "inventoryId": "stress-weak-conclusion",
  "scenario": {
    "primary": "research-decision",
    "secondary": "review-update"
  },
  "audienceIntent": "quick-understanding",
  "facts": [
    {
      "id": "q1",
      "type": "unresolved",
      "text": "先进模型是否可能具有值得道德考虑的体验仍是开放问题",
      "importance": "critical",
      "sourceRef": "q1",
      "confidence": "supported"
    },
    {
      "id": "e1",
      "type": "evidence",
      "text": "模型已表现出沟通、规划、解决问题和追求目标等能力",
      "importance": "high",
      "sourceRef": "e1",
      "confidence": "supported"
    },
    {
      "id": "e2",
      "type": "evidence",
      "text": "部分专家认为近期模型意识与高能动性存在非零可能",
      "importance": "medium",
      "sourceRef": "e2",
      "confidence": "supported"
    },
    {
      "id": "r1",
      "type": "risk",
      "text": "意识、体验与道德地位缺少可靠测量方法",
      "importance": "high",
      "sourceRef": "r1",
      "confidence": "supported"
    },
    {
      "id": "a1",
      "type": "action",
      "text": "建立跨学科研究计划并提前准备治理框架",
      "importance": "high",
      "sourceRef": "a1",
      "confidence": "supported"
    }
  ],
  "relationships": [],
  "readingLayers": {
    "first": [
      "q1"
    ],
    "second": [
      "e1",
      "e2",
      "r1",
      "a1"
    ]
  },
  "completenessLedger": {
    "selected": [
      "q1",
      "e1",
      "e2",
      "r1",
      "a1"
    ],
    "merged": [],
    "downgraded": [],
    "omitted": []
  },
  "archetypeEvidence": [
    {
      "scenario": "research-decision",
      "score": 6,
      "evidence": {
        "titleTerms": [
          "开放问题"
        ],
        "factTypeHits": 3,
        "laneBonus": 0,
        "timeBonus": 0,
        "futureBonus": 0
      }
    },
    {
      "scenario": "review-update",
      "score": 4,
      "evidence": {
        "titleTerms": [],
        "factTypeHits": 4,
        "laneBonus": 0,
        "timeBonus": 0,
        "futureBonus": 0
      }
    },
    {
      "scenario": "project-plan",
      "score": 1,
      "evidence": {
        "titleTerms": [],
        "factTypeHits": 1,
        "laneBonus": 0,
        "timeBonus": 0,
        "futureBonus": 0
      }
    },
    {
      "scenario": "process-collaboration",
      "score": 0,
      "evidence": {
        "titleTerms": [],
        "factTypeHits": 0,
        "laneBonus": 0,
        "timeBonus": 0,
        "futureBonus": 0
      }
    },
    {
      "scenario": "product-capability",
      "score": 0,
      "evidence": {
        "titleTerms": [],
        "factTypeHits": 0,
        "laneBonus": 0,
        "timeBonus": 0,
        "futureBonus": 0
      }
    },
    {
      "scenario": "strategy-proposal",
      "score": 0,
      "evidence": {
        "titleTerms": [],
        "factTypeHits": 0,
        "laneBonus": 0,
        "timeBonus": 0,
        "futureBonus": 0
      }
    }
  ]
}
