{
  "schemaVersion": "1.0",
  "modelId": "semantic-official-flow-gpt5-router",
  "inventoryId": "official-flow-gpt5-router",
  "scenario": {
    "primary": "process-collaboration",
    "secondary": "project-plan"
  },
  "audienceIntent": "quick-understanding",
  "facts": [
    {
      "id": "p1",
      "type": "input",
      "text": "用户输入问题并可显式要求深度思考",
      "importance": "critical",
      "sourceRef": "p1",
      "confidence": "supported",
      "order": 1
    },
    {
      "id": "p2",
      "type": "constraint",
      "text": "路由器判断对话类型、复杂度和工具需求",
      "importance": "high",
      "sourceRef": "p2",
      "confidence": "supported",
      "order": 2
    },
    {
      "id": "p3",
      "type": "action",
      "text": "日常任务进入快速模型，复杂任务进入推理模型",
      "importance": "high",
      "sourceRef": "p3",
      "confidence": "supported",
      "order": 3
    },
    {
      "id": "p4",
      "type": "action",
      "text": "模型生成回答并收集切换、偏好和正确性信号",
      "importance": "high",
      "sourceRef": "p4",
      "confidence": "supported",
      "order": 4
    },
    {
      "id": "r1",
      "type": "risk",
      "text": "额度达到上限后由对应 mini 模型承接剩余请求",
      "importance": "medium",
      "sourceRef": "r1",
      "confidence": "supported",
      "order": 5
    }
  ],
  "relationships": [
    {
      "id": "rel-1",
      "type": "precedes",
      "from": "p1",
      "to": "p2"
    },
    {
      "id": "rel-2",
      "type": "precedes",
      "from": "p2",
      "to": "p3"
    },
    {
      "id": "rel-3",
      "type": "precedes",
      "from": "p3",
      "to": "p4"
    },
    {
      "id": "rel-4",
      "type": "precedes",
      "from": "p4",
      "to": "r1"
    }
  ],
  "readingLayers": {
    "first": [
      "p1"
    ],
    "second": [
      "p2",
      "p3",
      "p4",
      "r1"
    ]
  },
  "completenessLedger": {
    "selected": [
      "p1",
      "p2",
      "p3",
      "p4",
      "r1"
    ],
    "merged": [],
    "downgraded": [],
    "omitted": []
  },
  "archetypeEvidence": [
    {
      "scenario": "process-collaboration",
      "score": 5,
      "evidence": {
        "titleTerms": [
          "流程"
        ],
        "factTypeHits": 2,
        "laneBonus": 0,
        "timeBonus": 0,
        "futureBonus": 0
      }
    },
    {
      "scenario": "project-plan",
      "score": 3,
      "evidence": {
        "titleTerms": [],
        "factTypeHits": 3,
        "laneBonus": 0,
        "timeBonus": 0,
        "futureBonus": 0
      }
    },
    {
      "scenario": "research-decision",
      "score": 3,
      "evidence": {
        "titleTerms": [
          "决策"
        ],
        "factTypeHits": 0,
        "laneBonus": 0,
        "timeBonus": 0,
        "futureBonus": 0
      }
    },
    {
      "scenario": "product-capability",
      "score": 2,
      "evidence": {
        "titleTerms": [],
        "factTypeHits": 2,
        "laneBonus": 0,
        "timeBonus": 0,
        "futureBonus": 0
      }
    },
    {
      "scenario": "review-update",
      "score": 1,
      "evidence": {
        "titleTerms": [],
        "factTypeHits": 1,
        "laneBonus": 0,
        "timeBonus": 0,
        "futureBonus": 0
      }
    },
    {
      "scenario": "strategy-proposal",
      "score": 0,
      "evidence": {
        "titleTerms": [],
        "factTypeHits": 0,
        "laneBonus": 0,
        "timeBonus": 0,
        "futureBonus": 0
      }
    }
  ]
}
