{
  "schemaVersion": "1.0",
  "modelId": "semantic-official-product-codex-ga",
  "inventoryId": "official-product-codex-ga",
  "scenario": {
    "primary": "product-capability"
  },
  "audienceIntent": "quick-understanding",
  "facts": [
    {
      "id": "c1",
      "type": "conclusion",
      "text": "Codex 已成为覆盖编辑器、终端、云端与团队协作的编码 Agent",
      "importance": "critical",
      "sourceRef": "c1",
      "confidence": "supported"
    },
    {
      "id": "h1",
      "type": "capability",
      "text": "Slack 集成让团队可直接从频道委派任务",
      "importance": "high",
      "sourceRef": "h1",
      "confidence": "supported"
    },
    {
      "id": "h2",
      "type": "capability",
      "text": "Codex SDK 可将同一 Agent 嵌入工作流和应用",
      "importance": "high",
      "sourceRef": "h2",
      "confidence": "supported"
    },
    {
      "id": "h3",
      "type": "capability",
      "text": "管理工具提供环境控制、监控和分析能力",
      "importance": "high",
      "sourceRef": "h3",
      "confidence": "supported"
    },
    {
      "id": "p1",
      "type": "capability",
      "text": "同一账户连接编辑器、终端和云端任务",
      "importance": "medium",
      "sourceRef": "p1",
      "confidence": "supported",
      "visualType": "process-chain"
    },
    {
      "id": "r1",
      "type": "risk",
      "text": "团队规模化使用需要统一环境与管理员控制",
      "importance": "high",
      "sourceRef": "r1",
      "confidence": "supported"
    }
  ],
  "relationships": [],
  "readingLayers": {
    "first": [
      "c1"
    ],
    "second": [
      "h1",
      "h2",
      "h3",
      "p1",
      "r1"
    ]
  },
  "completenessLedger": {
    "selected": [
      "c1",
      "h1",
      "h2",
      "h3",
      "p1",
      "r1"
    ],
    "merged": [],
    "downgraded": [],
    "omitted": []
  },
  "archetypeEvidence": [
    {
      "scenario": "product-capability",
      "score": 10,
      "evidence": {
        "titleTerms": [
          "能力",
          "介绍"
        ],
        "factTypeHits": 4,
        "laneBonus": 0,
        "timeBonus": 0,
        "futureBonus": 0
      }
    },
    {
      "scenario": "process-collaboration",
      "score": 4,
      "evidence": {
        "titleTerms": [
          "协作"
        ],
        "factTypeHits": 1,
        "laneBonus": 0,
        "timeBonus": 0,
        "futureBonus": 0
      }
    },
    {
      "scenario": "project-plan",
      "score": 2,
      "evidence": {
        "titleTerms": [],
        "factTypeHits": 2,
        "laneBonus": 0,
        "timeBonus": 0,
        "futureBonus": 0
      }
    },
    {
      "scenario": "review-update",
      "score": 1,
      "evidence": {
        "titleTerms": [],
        "factTypeHits": 1,
        "laneBonus": 0,
        "timeBonus": 0,
        "futureBonus": 0
      }
    },
    {
      "scenario": "strategy-proposal",
      "score": 1,
      "evidence": {
        "titleTerms": [],
        "factTypeHits": 1,
        "laneBonus": 0,
        "timeBonus": 0,
        "futureBonus": 0
      }
    },
    {
      "scenario": "research-decision",
      "score": 0,
      "evidence": {
        "titleTerms": [],
        "factTypeHits": 0,
        "laneBonus": 0,
        "timeBonus": 0,
        "futureBonus": 0
      }
    }
  ]
}
