{
  "schemaVersion": "1.0",
  "modelId": "semantic-official-research-gpt5-system",
  "inventoryId": "official-research-gpt5-system",
  "scenario": {
    "primary": "research-decision"
  },
  "audienceIntent": "quick-understanding",
  "facts": [
    {
      "id": "q1",
      "type": "unresolved",
      "text": "不同复杂度任务应如何选择快速模型、推理模型与路由系统",
      "importance": "critical",
      "sourceRef": "q1",
      "confidence": "supported"
    },
    {
      "id": "o1",
      "type": "option",
      "text": "快速模型适合多数高吞吐日常问题",
      "importance": "high",
      "sourceRef": "o1",
      "confidence": "supported"
    },
    {
      "id": "o2",
      "type": "option",
      "text": "推理模型适合复杂问题、工具调用和更深分析",
      "importance": "high",
      "sourceRef": "o2",
      "confidence": "supported"
    },
    {
      "id": "e1",
      "type": "evidence",
      "text": "实时路由器依据对话类型、复杂度、工具需求和显式意图进行选择",
      "importance": "high",
      "sourceRef": "e1",
      "confidence": "supported"
    },
    {
      "id": "r1",
      "type": "risk",
      "text": "高风险任务仍需人工验证模型输出",
      "importance": "medium",
      "sourceRef": "r1",
      "confidence": "supported"
    },
    {
      "id": "c1",
      "type": "conclusion",
      "text": "采用统一路由并为高风险任务保留显式模型与验证控制",
      "importance": "high",
      "sourceRef": "c1",
      "confidence": "supported"
    }
  ],
  "relationships": [],
  "readingLayers": {
    "first": [
      "q1"
    ],
    "second": [
      "o1",
      "o2",
      "e1",
      "r1",
      "c1"
    ]
  },
  "completenessLedger": {
    "selected": [
      "q1",
      "o1",
      "o2",
      "e1",
      "r1",
      "c1"
    ],
    "merged": [],
    "downgraded": [],
    "omitted": []
  },
  "archetypeEvidence": [
    {
      "scenario": "research-decision",
      "score": 10,
      "evidence": {
        "titleTerms": [
          "调研",
          "决策"
        ],
        "factTypeHits": 4,
        "laneBonus": 0,
        "timeBonus": 0,
        "futureBonus": 0
      }
    },
    {
      "scenario": "strategy-proposal",
      "score": 3,
      "evidence": {
        "titleTerms": [],
        "factTypeHits": 3,
        "laneBonus": 0,
        "timeBonus": 0,
        "futureBonus": 0
      }
    },
    {
      "scenario": "review-update",
      "score": 2,
      "evidence": {
        "titleTerms": [],
        "factTypeHits": 2,
        "laneBonus": 0,
        "timeBonus": 0,
        "futureBonus": 0
      }
    },
    {
      "scenario": "product-capability",
      "score": 1,
      "evidence": {
        "titleTerms": [],
        "factTypeHits": 1,
        "laneBonus": 0,
        "timeBonus": 0,
        "futureBonus": 0
      }
    },
    {
      "scenario": "project-plan",
      "score": 1,
      "evidence": {
        "titleTerms": [],
        "factTypeHits": 1,
        "laneBonus": 0,
        "timeBonus": 0,
        "futureBonus": 0
      }
    },
    {
      "scenario": "process-collaboration",
      "score": 0,
      "evidence": {
        "titleTerms": [],
        "factTypeHits": 0,
        "laneBonus": 0,
        "timeBonus": 0,
        "futureBonus": 0
      }
    }
  ]
}
