{
  "schemaVersion": "1.0",
  "modelId": "semantic-stress-long-economic-index",
  "inventoryId": "stress-long-economic-index",
  "scenario": {
    "primary": "research-decision",
    "secondary": "review-update"
  },
  "audienceIntent": "quick-understanding",
  "facts": [
    {
      "id": "q1",
      "type": "unresolved",
      "text": "AI 使用节律、产物类型和自动化程度如何共同影响工作体验",
      "importance": "critical",
      "sourceRef": "q1",
      "confidence": "supported"
    },
    {
      "id": "e1",
      "type": "evidence",
      "text": "工作相关请求在周末下降且不同职业的节律存在差异",
      "importance": "high",
      "sourceRef": "e1",
      "confidence": "supported"
    },
    {
      "id": "e2",
      "type": "evidence",
      "text": "Chat、Cowork、Claude Code 与 API 产生的产物类型明显不同",
      "importance": "high",
      "sourceRef": "e2",
      "confidence": "supported"
    },
    {
      "id": "e3",
      "type": "evidence",
      "text": "更自动化的用户对 AI 承担更多任务更乐观",
      "importance": "high",
      "sourceRef": "e3",
      "confidence": "supported"
    },
    {
      "id": "m1",
      "type": "metric",
      "text": "研究引入更高频抽样以观察小时级使用变化",
      "importance": "medium",
      "sourceRef": "m1",
      "confidence": "supported",
      "value": "hourly"
    },
    {
      "id": "r1",
      "type": "risk",
      "text": "产品、职业和时间分布差异使单一平均数容易误导",
      "importance": "high",
      "sourceRef": "r1",
      "confidence": "supported"
    },
    {
      "id": "c1",
      "type": "conclusion",
      "text": "应按产品、产物和自动化程度分层解释 AI 的工作影响",
      "importance": "high",
      "sourceRef": "c1",
      "confidence": "supported"
    }
  ],
  "relationships": [],
  "readingLayers": {
    "first": [
      "q1"
    ],
    "second": [
      "e1",
      "e2",
      "e3",
      "m1",
      "r1",
      "c1"
    ]
  },
  "completenessLedger": {
    "selected": [
      "q1",
      "e1",
      "e2",
      "e3",
      "m1",
      "r1",
      "c1"
    ],
    "merged": [],
    "downgraded": [],
    "omitted": []
  },
  "archetypeEvidence": [
    {
      "scenario": "research-decision",
      "score": 6,
      "evidence": {
        "titleTerms": [
          "研究"
        ],
        "factTypeHits": 3,
        "laneBonus": 0,
        "timeBonus": 0,
        "futureBonus": 0
      }
    },
    {
      "scenario": "review-update",
      "score": 4,
      "evidence": {
        "titleTerms": [],
        "factTypeHits": 4,
        "laneBonus": 0,
        "timeBonus": 0,
        "futureBonus": 0
      }
    },
    {
      "scenario": "product-capability",
      "score": 1,
      "evidence": {
        "titleTerms": [],
        "factTypeHits": 1,
        "laneBonus": 0,
        "timeBonus": 0,
        "futureBonus": 0
      }
    },
    {
      "scenario": "project-plan",
      "score": 1,
      "evidence": {
        "titleTerms": [],
        "factTypeHits": 1,
        "laneBonus": 0,
        "timeBonus": 0,
        "futureBonus": 0
      }
    },
    {
      "scenario": "strategy-proposal",
      "score": 1,
      "evidence": {
        "titleTerms": [],
        "factTypeHits": 1,
        "laneBonus": 0,
        "timeBonus": 0,
        "futureBonus": 0
      }
    },
    {
      "scenario": "process-collaboration",
      "score": 0,
      "evidence": {
        "titleTerms": [],
        "factTypeHits": 0,
        "laneBonus": 0,
        "timeBonus": 0,
        "futureBonus": 0
      }
    }
  ]
}
