{
  "schemaVersion": "1.0",
  "modelId": "semantic-official-plan-agent-research",
  "inventoryId": "official-plan-agent-research",
  "scenario": {
    "primary": "project-plan",
    "secondary": "review-update"
  },
  "audienceIntent": "quick-understanding",
  "facts": [
    {
      "id": "c1",
      "type": "objective",
      "text": "研究将从基线调查推进到随机实验以评估编码 Agent 的真实影响",
      "importance": "critical",
      "sourceRef": "c1",
      "confidence": "supported"
    },
    {
      "id": "t1",
      "type": "stage",
      "text": "阶段一完成 1260 名社会科学家的基线调查",
      "importance": "high",
      "sourceRef": "t1",
      "confidence": "supported",
      "order": 1
    },
    {
      "id": "t2",
      "type": "stage",
      "text": "阶段二向研究者提供 Claude Code 并开展随机实验",
      "importance": "high",
      "sourceRef": "t2",
      "confidence": "supported",
      "order": 2
    },
    {
      "id": "t3",
      "type": "stage",
      "text": "阶段三发布生产率、采用差异和研究质量结果",
      "importance": "high",
      "sourceRef": "t3",
      "confidence": "supported",
      "order": 3
    },
    {
      "id": "r1",
      "type": "risk",
      "text": "当前相关性结果可能受到早期采用者差异影响",
      "importance": "high",
      "sourceRef": "r1",
      "confidence": "supported"
    },
    {
      "id": "a1",
      "type": "action",
      "text": "用随机实验区分工具作用与用户自选择效应",
      "importance": "high",
      "sourceRef": "a1",
      "confidence": "supported"
    }
  ],
  "relationships": [],
  "readingLayers": {
    "first": [
      "c1"
    ],
    "second": [
      "t1",
      "t2",
      "t3",
      "r1",
      "a1"
    ]
  },
  "completenessLedger": {
    "selected": [
      "c1",
      "t1",
      "t2",
      "t3",
      "r1",
      "a1"
    ],
    "merged": [],
    "downgraded": [],
    "omitted": []
  },
  "archetypeEvidence": [
    {
      "scenario": "project-plan",
      "score": 5,
      "evidence": {
        "titleTerms": [],
        "factTypeHits": 3,
        "laneBonus": 0,
        "timeBonus": 0,
        "futureBonus": 2
      }
    },
    {
      "scenario": "review-update",
      "score": 5,
      "evidence": {
        "titleTerms": [
          "阶段"
        ],
        "factTypeHits": 2,
        "laneBonus": 0,
        "timeBonus": 0,
        "futureBonus": 0
      }
    },
    {
      "scenario": "research-decision",
      "score": 3,
      "evidence": {
        "titleTerms": [
          "研究"
        ],
        "factTypeHits": 0,
        "laneBonus": 0,
        "timeBonus": 0,
        "futureBonus": 0
      }
    },
    {
      "scenario": "product-capability",
      "score": 1,
      "evidence": {
        "titleTerms": [],
        "factTypeHits": 1,
        "laneBonus": 0,
        "timeBonus": 0,
        "futureBonus": 0
      }
    },
    {
      "scenario": "strategy-proposal",
      "score": 1,
      "evidence": {
        "titleTerms": [],
        "factTypeHits": 1,
        "laneBonus": 0,
        "timeBonus": 0,
        "futureBonus": 0
      }
    },
    {
      "scenario": "process-collaboration",
      "score": 0,
      "evidence": {
        "titleTerms": [],
        "factTypeHits": 0,
        "laneBonus": 0,
        "timeBonus": 0,
        "futureBonus": 0
      }
    }
  ]
}
