{
  "schemaVersion": "1.0",
  "modelId": "semantic-mixed-3",
  "inventoryId": "mixed-3",
  "scenario": {
    "primary": "research-decision"
  },
  "audienceIntent": "quick-understanding",
  "facts": [
    {
      "id": "c1",
      "type": "conclusion",
      "text": "选择开放架构方案",
      "importance": "critical",
      "sourceRef": "c1",
      "confidence": "supported"
    },
    {
      "id": "o1",
      "type": "option",
      "text": "A 方案扩展性更强",
      "importance": "high",
      "sourceRef": "o1",
      "confidence": "supported"
    },
    {
      "id": "o2",
      "type": "option",
      "text": "B 方案迁移成本更低",
      "importance": "high",
      "sourceRef": "o2",
      "confidence": "supported"
    },
    {
      "id": "e1",
      "type": "evidence",
      "text": "压测结果支持 A 方案",
      "importance": "high",
      "sourceRef": "e1",
      "confidence": "supported"
    },
    {
      "id": "r1",
      "type": "risk",
      "text": "迁移窗口有限",
      "importance": "high",
      "sourceRef": "r1",
      "confidence": "supported"
    }
  ],
  "relationships": [],
  "readingLayers": {
    "first": [
      "c1"
    ],
    "second": [
      "o1",
      "o2",
      "e1",
      "r1"
    ]
  },
  "completenessLedger": {
    "selected": [
      "c1",
      "o1",
      "o2",
      "e1",
      "r1"
    ],
    "merged": [],
    "downgraded": [],
    "omitted": []
  },
  "archetypeEvidence": [
    {
      "scenario": "research-decision",
      "score": 9,
      "evidence": {
        "titleTerms": [
          "研究",
          "选型"
        ],
        "factTypeHits": 3,
        "laneBonus": 0,
        "timeBonus": 0,
        "futureBonus": 0
      }
    },
    {
      "scenario": "strategy-proposal",
      "score": 6,
      "evidence": {
        "titleTerms": [
          "方案"
        ],
        "factTypeHits": 3,
        "laneBonus": 0,
        "timeBonus": 0,
        "futureBonus": 0
      }
    },
    {
      "scenario": "review-update",
      "score": 2,
      "evidence": {
        "titleTerms": [],
        "factTypeHits": 2,
        "laneBonus": 0,
        "timeBonus": 0,
        "futureBonus": 0
      }
    },
    {
      "scenario": "product-capability",
      "score": 1,
      "evidence": {
        "titleTerms": [],
        "factTypeHits": 1,
        "laneBonus": 0,
        "timeBonus": 0,
        "futureBonus": 0
      }
    },
    {
      "scenario": "project-plan",
      "score": 1,
      "evidence": {
        "titleTerms": [],
        "factTypeHits": 1,
        "laneBonus": 0,
        "timeBonus": 0,
        "futureBonus": 0
      }
    },
    {
      "scenario": "process-collaboration",
      "score": 0,
      "evidence": {
        "titleTerms": [],
        "factTypeHits": 0,
        "laneBonus": 0,
        "timeBonus": 0,
        "futureBonus": 0
      }
    }
  ]
}
