{
  "schemaVersion": "1.0",
  "modelId": "semantic-stress-duplicate-codex-scaling",
  "inventoryId": "stress-duplicate-codex-scaling",
  "scenario": {
    "primary": "review-update"
  },
  "audienceIntent": "quick-understanding",
  "facts": [
    {
      "id": "c1",
      "type": "conclusion",
      "text": "Codex 企业采用从个人工具快速进入组织工作流",
      "importance": "critical",
      "sourceRef": "c1",
      "confidence": "supported"
    },
    {
      "id": "m1",
      "type": "metric",
      "text": "Codex 周活跃开发者在两周内从 300 万增至 400 万以上",
      "importance": "high",
      "sourceRef": "m1",
      "confidence": "supported",
      "value": "4M+"
    },
    {
      "id": "e1",
      "type": "evidence",
      "text": "企业正在测试覆盖率、团队速度和技术债治理场景",
      "importance": "high",
      "sourceRef": "e1",
      "confidence": "supported"
    },
    {
      "id": "e2",
      "type": "evidence",
      "text": "企业正在软件开发生命周期中寻找高价值 Codex 用例",
      "importance": "medium",
      "sourceRef": "e2",
      "confidence": "supported"
    },
    {
      "id": "r1",
      "type": "risk",
      "text": "试点成果尚未自动等于生产级规模化能力",
      "importance": "high",
      "sourceRef": "r1",
      "confidence": "supported"
    },
    {
      "id": "a1",
      "type": "action",
      "text": "将验证有效的用例沉淀成生产部署与治理方法",
      "importance": "high",
      "sourceRef": "a1",
      "confidence": "supported"
    }
  ],
  "relationships": [],
  "readingLayers": {
    "first": [
      "c1"
    ],
    "second": [
      "m1",
      "e1",
      "e2",
      "r1",
      "a1"
    ]
  },
  "completenessLedger": {
    "selected": [
      "c1",
      "m1",
      "e1",
      "e2",
      "r1",
      "a1"
    ],
    "merged": [],
    "downgraded": [],
    "omitted": []
  },
  "archetypeEvidence": [
    {
      "scenario": "review-update",
      "score": 8,
      "evidence": {
        "titleTerms": [
          "阶段"
        ],
        "factTypeHits": 5,
        "laneBonus": 0,
        "timeBonus": 0,
        "futureBonus": 0
      }
    },
    {
      "scenario": "project-plan",
      "score": 3,
      "evidence": {
        "titleTerms": [],
        "factTypeHits": 1,
        "laneBonus": 0,
        "timeBonus": 0,
        "futureBonus": 2
      }
    },
    {
      "scenario": "research-decision",
      "score": 2,
      "evidence": {
        "titleTerms": [],
        "factTypeHits": 2,
        "laneBonus": 0,
        "timeBonus": 0,
        "futureBonus": 0
      }
    },
    {
      "scenario": "product-capability",
      "score": 1,
      "evidence": {
        "titleTerms": [],
        "factTypeHits": 1,
        "laneBonus": 0,
        "timeBonus": 0,
        "futureBonus": 0
      }
    },
    {
      "scenario": "strategy-proposal",
      "score": 1,
      "evidence": {
        "titleTerms": [],
        "factTypeHits": 1,
        "laneBonus": 0,
        "timeBonus": 0,
        "futureBonus": 0
      }
    },
    {
      "scenario": "process-collaboration",
      "score": 0,
      "evidence": {
        "titleTerms": [],
        "factTypeHits": 0,
        "laneBonus": 0,
        "timeBonus": 0,
        "futureBonus": 0
      }
    }
  ]
}
