{
  "schemaVersion": "1.0",
  "modelId": "semantic-strategy-1",
  "inventoryId": "strategy-1",
  "scenario": {
    "primary": "strategy-proposal"
  },
  "audienceIntent": "quick-understanding",
  "facts": [
    {
      "id": "c1",
      "type": "conclusion",
      "text": "建议从高价值场景切入",
      "importance": "critical",
      "sourceRef": "c1",
      "confidence": "supported"
    },
    {
      "id": "e1",
      "type": "evidence",
      "text": "重点客户需求集中在效率和稳定性",
      "importance": "high",
      "sourceRef": "e1",
      "confidence": "supported"
    },
    {
      "id": "r1",
      "type": "risk",
      "text": "资源投入与回报周期存在不确定性",
      "importance": "high",
      "sourceRef": "r1",
      "confidence": "supported"
    },
    {
      "id": "a1",
      "type": "action",
      "text": "先完成小范围验证",
      "importance": "high",
      "sourceRef": "a1",
      "confidence": "supported"
    },
    {
      "id": "x1",
      "type": "constraint",
      "text": "预算和人力必须控制在现有范围",
      "importance": "high",
      "sourceRef": "x1",
      "confidence": "supported"
    }
  ],
  "relationships": [],
  "readingLayers": {
    "first": [
      "c1"
    ],
    "second": [
      "e1",
      "r1",
      "a1",
      "x1"
    ]
  },
  "completenessLedger": {
    "selected": [
      "c1",
      "e1",
      "r1",
      "a1",
      "x1"
    ],
    "merged": [],
    "downgraded": [],
    "omitted": []
  },
  "archetypeEvidence": [
    {
      "scenario": "strategy-proposal",
      "score": 8,
      "evidence": {
        "titleTerms": [
          "策略",
          "方案"
        ],
        "factTypeHits": 2,
        "laneBonus": 0,
        "timeBonus": 0,
        "futureBonus": 0
      }
    },
    {
      "scenario": "review-update",
      "score": 3,
      "evidence": {
        "titleTerms": [],
        "factTypeHits": 3,
        "laneBonus": 0,
        "timeBonus": 0,
        "futureBonus": 0
      }
    },
    {
      "scenario": "product-capability",
      "score": 1,
      "evidence": {
        "titleTerms": [],
        "factTypeHits": 1,
        "laneBonus": 0,
        "timeBonus": 0,
        "futureBonus": 0
      }
    },
    {
      "scenario": "project-plan",
      "score": 1,
      "evidence": {
        "titleTerms": [],
        "factTypeHits": 1,
        "laneBonus": 0,
        "timeBonus": 0,
        "futureBonus": 0
      }
    },
    {
      "scenario": "research-decision",
      "score": 1,
      "evidence": {
        "titleTerms": [],
        "factTypeHits": 1,
        "laneBonus": 0,
        "timeBonus": 0,
        "futureBonus": 0
      }
    },
    {
      "scenario": "process-collaboration",
      "score": 0,
      "evidence": {
        "titleTerms": [],
        "factTypeHits": 0,
        "laneBonus": 0,
        "timeBonus": 0,
        "futureBonus": 0
      }
    }
  ]
}
