{
  "schemaVersion": "1.0",
  "modelId": "semantic-badcase-audit-assistant-capability",
  "inventoryId": "badcase-audit-assistant-capability",
  "scenario": {
    "primary": "product-capability"
  },
  "audienceIntent": "quick-understanding",
  "facts": [
    {
      "id": "c1",
      "type": "conclusion",
      "text": "用户在飞书群聊输入分析关键词与队列 ID，即可自动完成查询、诊断与卡片输出。",
      "importance": "critical",
      "sourceRef": "c1",
      "confidence": "supported"
    },
    {
      "id": "p1",
      "type": "capability",
      "text": "群聊触发：@审核智能助手并输入关键词和队列 ID。",
      "importance": "high",
      "sourceRef": "p1",
      "confidence": "supported",
      "visualType": "process-chain",
      "order": 1
    },
    {
      "id": "p2",
      "type": "capability",
      "text": "自动查询：拉取近 7 天进审量、审核量、延时达标率与废弃量。",
      "importance": "high",
      "sourceRef": "p2",
      "confidence": "supported",
      "visualType": "process-chain",
      "order": 2
    },
    {
      "id": "p3",
      "type": "capability",
      "text": "智能分析：识别异常波动、延时原因、增量空间与任务池配置。",
      "importance": "high",
      "sourceRef": "p3",
      "confidence": "supported",
      "visualType": "process-chain",
      "order": 3
    },
    {
      "id": "p4",
      "type": "capability",
      "text": "结果输出：生成群聊简报卡片并保留完整报告入口。",
      "importance": "high",
      "sourceRef": "p4",
      "confidence": "supported",
      "visualType": "process-chain",
      "order": 4
    },
    {
      "id": "h1",
      "type": "capability",
      "text": "量级异常分析支持队列级归因。",
      "importance": "high",
      "sourceRef": "h1",
      "confidence": "supported"
    },
    {
      "id": "h2",
      "type": "capability",
      "text": "延时分析支持 SLA 诊断。",
      "importance": "high",
      "sourceRef": "h2",
      "confidence": "supported"
    },
    {
      "id": "h3",
      "type": "capability",
      "text": "RR 调整支持增量空间判断。",
      "importance": "medium",
      "sourceRef": "h3",
      "confidence": "supported"
    },
    {
      "id": "h4",
      "type": "capability",
      "text": "任务池查询支持配置回溯。",
      "importance": "medium",
      "sourceRef": "h4",
      "confidence": "supported"
    },
    {
      "id": "h5",
      "type": "capability",
      "text": "知识库问答支持口径与术语解释。",
      "importance": "medium",
      "sourceRef": "h5",
      "confidence": "supported"
    },
    {
      "id": "e1",
      "type": "evidence",
      "text": "知识库沉淀场景导航、通用决策约定、概念解释、错误原因与日志。",
      "importance": "high",
      "sourceRef": "e1",
      "confidence": "supported"
    },
    {
      "id": "a1",
      "type": "action",
      "text": "继续扩展知识库并统一群内调用口径。",
      "importance": "medium",
      "sourceRef": "a1",
      "confidence": "supported"
    }
  ],
  "relationships": [],
  "readingLayers": {
    "first": [
      "c1"
    ],
    "second": [
      "p1",
      "p2",
      "p3",
      "p4",
      "h1",
      "h2",
      "h3",
      "h4",
      "h5",
      "e1",
      "a1"
    ]
  },
  "completenessLedger": {
    "selected": [
      "c1",
      "p1",
      "p2",
      "p3",
      "p4",
      "h1",
      "h2",
      "h3",
      "h4",
      "h5",
      "e1",
      "a1"
    ],
    "merged": [],
    "downgraded": [],
    "omitted": []
  },
  "archetypeEvidence": [
    {
      "scenario": "product-capability",
      "score": 11,
      "evidence": {
        "titleTerms": [
          "能力",
          "助手"
        ],
        "factTypeHits": 5,
        "laneBonus": 0,
        "timeBonus": 0,
        "futureBonus": 0
      }
    },
    {
      "scenario": "process-collaboration",
      "score": 2,
      "evidence": {
        "titleTerms": [],
        "factTypeHits": 2,
        "laneBonus": 0,
        "timeBonus": 0,
        "futureBonus": 0
      }
    },
    {
      "scenario": "project-plan",
      "score": 2,
      "evidence": {
        "titleTerms": [],
        "factTypeHits": 2,
        "laneBonus": 0,
        "timeBonus": 0,
        "futureBonus": 0
      }
    },
    {
      "scenario": "review-update",
      "score": 2,
      "evidence": {
        "titleTerms": [],
        "factTypeHits": 2,
        "laneBonus": 0,
        "timeBonus": 0,
        "futureBonus": 0
      }
    },
    {
      "scenario": "research-decision",
      "score": 1,
      "evidence": {
        "titleTerms": [],
        "factTypeHits": 1,
        "laneBonus": 0,
        "timeBonus": 0,
        "futureBonus": 0
      }
    },
    {
      "scenario": "strategy-proposal",
      "score": 1,
      "evidence": {
        "titleTerms": [],
        "factTypeHits": 1,
        "laneBonus": 0,
        "timeBonus": 0,
        "futureBonus": 0
      }
    }
  ]
}
